{"job_id":"1f0c2c9a-2f1a-4a3e-9d1a-3b6c8e5d4f21","language":"en","fit_summary":["I own the ledger service that settles 40 million transactions a day.","I led the move from a nightly batch to an event-driven pipeline, which cut settlement lag from hours to minutes.","I run the on-call rotation for a service other teams depend on."],"cover_note":"Your posting describes a payments team that owns its services end to end, which is the work I do now. I run a ledger service at a scale where ordering, retries and reconciliation all have to hold at once. I have spent the last years on Kotlin services and on the event pipeline other teams build on. The part of your posting about settlement is what made me read it twice. I am employed and not in a hurry, so I am choosy about what comes next. If the role is what the posting describes, I would like to talk.","ats_answers":[{"question":"Why do you want to work here?","answer":"You build your own settlement platform, and that is the work I have done for the last four years. The posting names the product and the team, which is rare enough to be worth a conversation."},{"question":"Are you open to relocation?","answer":"I work remote-first and relocation is on the table for the right role. For an on-site team I would want to know what the relocation package covers."},{"question":"Do you have work authorization?","answer":"I am authorized to work in Exampleland."},{"question":"Earliest start date","answer":"Open to discuss. [CONFIRM]"},{"question":"Compensation expectation","answer":"Open to discuss. [CONFIRM]"},{"question":"LinkedIn profile","answer":"LinkedIn profile URL [CONFIRM]"}],"call_questions":["Who owns the platform roadmap, and how are its priorities decided?","How does the team split work between product features and internal tooling?","Is the role offered as employment, as a contractor engagement, or either?"]}
